{
  "run_id": "gd_20260516_001",
  "task_id": "task_003",
  "status": "completed",
  "summary": "已完成工作流方案，补齐流程图、节点设计、失败重试、人工审核和最终报告。",
  "artifacts": [
    "docs/WORKFLOW_DESIGN.md",
    "examples/sample_final_report.md"
  ],
  "known_issues": [],
  "evidence": [
    {
      "criterion": "必须输出完整流程图",
      "status": "pass",
      "detail": "docs/WORKFLOW_DESIGN.md 中包含 Mermaid 总体流程图。"
    },
    {
      "criterion": "必须包含 n8n 节点设计",
      "status": "pass",
      "detail": "docs/WORKFLOW_DESIGN.md 逐个描述了 Master、Executor、Checker、Error Handler 节点职责。"
    },
    {
      "criterion": "必须包含失败重试逻辑",
      "status": "pass",
      "detail": "设计中包含 Criteria 未达标后进入下一轮任务的重试分支。"
    },
    {
      "criterion": "必须包含人工审核节点",
      "status": "pass",
      "detail": "设计中包含 Human Approval Gate。"
    },
    {
      "criterion": "必须生成最终 Markdown 报告",
      "status": "pass",
      "detail": "examples/sample_final_report.md 已生成。"
    }
  ],
  "next_action_suggestion": "运行 Criteria Checker 进行最终确认。",
  "error": null
}

